その他,,G-01,塩トラウト筋子（養殖）,https://file003.shop-pro.jp/PA01452/887/img/G-01-M.jpg,作成する,,,,,,,,,,2500,2350,3000,1400,20,在庫管理する,1,100,,,,,個,,表示する,50,1,程良い塩梅と旨味が、アツアツご飯に、大根おろしを添えて酒のあてにピッタリです。,程良い塩梅と旨味が、アツアツご飯に、大根おろしを添えて酒のあてにピッタリです。,程良い塩梅と旨味が、アツアツご飯に、大根おろしを添えて酒のあてにピッタリです。,程良い塩梅と旨味が、アツアツご飯に、大根おろしを添えて酒のあてにピッタリです。,程良い塩梅と旨味が、アツアツご飯に、大根おろしを添えて酒のあてにピッタリです。,前方に表示,1,,,,,,,,,,,,,熊谷食品-弘前市-/塩トラウト筋子（養殖）,熊谷食品-弘前市-/塩トラウト筋子（養殖）,熊谷食品-弘前市-/塩トラウト筋子（養殖）,0,掲載する,0
その他,,G-02,塩たらこ,https://file003.shop-pro.jp/PA01452/887/img/G-02-M.jpg,作成する,,,,,,,,,,2500,2350,3000,1400,20,在庫管理する,1,100,,,,,個,,表示する,50,1,粒のしっかりした程良い塩味が、生で良し、焼いても良し、おにぎりにもピッタリです。,粒のしっかりした程良い塩味が、生で良し、焼いても良し、おにぎりにもピッタリです。,粒のしっかりした程良い塩味が、生で良し、焼いても良し、おにぎりにもピッタリです。,粒のしっかりした程良い塩味が、生で良し、焼いても良し、おにぎりにもピッタリです。,粒のしっかりした程良い塩味が、生で良し、焼いても良し、おにぎりにもピッタリです。,前方に表示,1,,,,,,,,,,,,,熊谷食品-弘前市-/塩たらこ,熊谷食品-弘前市-/塩たらこ,熊谷食品-弘前市-/塩たらこ,0,掲載する,0
その他,,G-03,筋子&塩たらこ,https://file003.shop-pro.jp/PA01452/887/img/G-03-M.jpg,作成する,,,,,,,,,,2500,2350,3000,1400,20,在庫管理する,1,100,,,,,個,,表示する,50,1,【筋子】程良い塩梅と旨味が、アツアツご飯に、大根おろしを添えて酒のあてにピッタリです。【たらこ】粒のしっかりした程良い塩味が、生で良し、焼いても良し、おにぎりにもピッタリです。,【筋子】程良い塩梅と旨味が、アツアツご飯に、大根おろしを添えて酒のあてにピッタリです。【たらこ】粒のしっかりした程良い塩味が、生で良し、焼いても良し、おにぎりにもピッタリです。,【筋子】程良い塩梅と旨味が、アツアツご飯に、大根おろしを添えて酒のあてにピッタリです。【たらこ】粒のしっかりした程良い塩味が、生で良し、焼いても良し、おにぎりにもピッタリです。,【筋子】程良い塩梅と旨味が、アツアツご飯に、大根おろしを添えて酒のあてにピッタリです。【たらこ】粒のしっかりした程良い塩味が、生で良し、焼いても良し、おにぎりにもピッタリです。,【筋子】程良い塩梅と旨味が、アツアツご飯に、大根おろしを添えて酒のあてにピッタリです。【たらこ】粒のしっかりした程良い塩味が、生で良し、焼いても良し、おにぎりにもピッタリです。,前方に表示,1,,,,,,,,,,,,,熊谷食品-弘前市-/筋子&塩たらこ,熊谷食品-弘前市-/筋子&塩たらこ,熊谷食品-弘前市-/筋子&塩たらこ,0,掲載する,0
その他,,G-04-250,数の子づくし,https://file003.shop-pro.jp/PA01452/887/img/G-04-250-M.jpg,作成する,https://file003.shop-pro.jp/PA01452/887/img/G-04-250.jpg,,,,,,,,,2500,2350,3000,1400,20,在庫管理する,1,100,,,,,個,,表示する,50,1,数の子を、スルメ、昆布、醤油で漬け込みました。昆布の旨味とトロ味が味を深めた逸品です。,数の子を、スルメ、昆布、醤油で漬け込みました。昆布の旨味とトロ味が味を深めた逸品です。,数の子を、スルメ、昆布、醤油で漬け込みました。昆布の旨味とトロ味が味を深めた逸品です。,数の子を、スルメ、昆布、醤油で漬け込みました。昆布の旨味とトロ味が味を深めた逸品です。,数の子を、スルメ、昆布、醤油で漬け込みました。昆布の旨味とトロ味が味を深めた逸品です。,前方に表示,1,,,,,,,,,,,,,熊谷食品-弘前市-/数の子づくし,熊谷食品-弘前市-/数の子づくし,熊谷食品-弘前市-/数の子づくし,0,掲載する,0
その他,,G-06,味付数の子（ふりこ）,https://file003.shop-pro.jp/PA01452/887/img/G-06-M.jpg,作成する,https://file003.shop-pro.jp/PA01452/887/img/G-06.jpg,,,,,,,,,2500,2350,3000,1400,20,在庫管理する,1,100,,,,,個,,表示する,50,1,パリパリふりこの醤油漬けです。津軽風に山菜ミズと和えて頂くのもオススメです。,パリパリふりこの醤油漬けです。津軽風に山菜ミズと和えて頂くのもオススメです。,パリパリふりこの醤油漬けです。津軽風に山菜ミズと和えて頂くのもオススメです。,パリパリふりこの醤油漬けです。津軽風に山菜ミズと和えて頂くのもオススメです。,パリパリふりこの醤油漬けです。津軽風に山菜ミズと和えて頂くのもオススメです。,前方に表示,1,,,,,,,,,,,,,熊谷食品-弘前市-/味付数の子（ふりこ）,熊谷食品-弘前市-/味付数の子（ふりこ）,熊谷食品-弘前市-/味付数の子（ふりこ）,0,掲載する,0
その他,,H-01,紅鮭ハラス,https://file003.shop-pro.jp/PA01452/887/img/H-01-M.jpg,作成する,,,,,,,,,,2500,2350,3000,1400,20,在庫管理する,1,100,,,,,個,,表示する,50,1,,,,,,前方に表示,1,,,,,,,,,,,,,熊谷食品-弘前市-/紅鮭ハラス,熊谷食品-弘前市-/紅鮭ハラス,熊谷食品-弘前市-/紅鮭ハラス,0,掲載する,0
